{
  "format": "question-studio-additions",
  "schema_version": "0.1",
  "target": {
    "question_id": "demo-q3",
    "question_revision": 1,
    "content_sha256": "b541bb9d17e3132600a3f486b57ce1a3cf7920684ed26717b2b28288f58a96da"
  },
  "additions": [
    {
      "addition_id": "demo-q3-analysis-1",
      "kind": "analysis",
      "title": "配方与取等条件",
      "markdown": "先配方：$f(x)=x^2-2x+3=(x-1)^2+2$。\n\n由于 $(x-1)^2\\ge 0$，故 $f(x)\\ge 2$；等号当且仅当 $x=1$ 成立。于是最小值为 $2$，取最小值时 $x=1$。",
      "author": "项目合成示例"
    },
    {
      "addition_id": "demo-q3-visual-1",
      "kind": "visualization",
      "title": "平移与最小值",
      "markdown": "初始图像为 $y=(x-1)^2+2$，顶点是 $(1,2)$。\n\n固定 $a=1$，改变 $h$ 会水平平移，改变 $k$ 会竖直平移。回到初始参数时，最低点的纵坐标是 $2$。滑块变式用于比较，改变参数后不再是原题函数。",
      "author": "项目合成示例",
      "visualization": {
        "kind": "quadratic",
        "parameters": {
          "a": 1,
          "h": 1,
          "k": 2
        },
        "x_range": [
          -5,
          7
        ],
        "y_range": [
          -2,
          12
        ]
      }
    }
  ]
}
